1354,rog,2021-11-02,269.9,269.8,269.36,"['ROGERS CORPORATION INVESTOR ALERT BY THE FORMER ATTORNEY GENERAL OF LOUISIANA: Kahn Swick & Foti, LLC Investigates Adequacy of Price and Process in Proposed Sale of Rogers Corporation - ROG', 'ROGERS ALERT: Bragar Eagel & Squire, P.C. Investigates Sale of ROG and Encourages Investors to Contact the Firm', 'DuPont stock surges as profit beats forecast and $5.2 billion buyout of Rogers Corp. announced', 'Mid-Afternoon Market Update: Dow Rises Around 150 Points; Semler Scientific Shares Slide', 'DuPont Offers About $275 a Share for Rogers Corp.', 'Why Rogers Shares Are Soaring Today', 'Shareholder Alert: Ademi LLP investigates whether Rogers Corporation has obtained a Fair Price in its transaction with DuPont', 'Rogers Merger Investigation: Halper Sadeh LLP Announces Investigation Into Whether the Sale of Rogers Corporation Is Fair to Shareholders; Investors Are Encouraged to Contact the Firm  ROG', 'Mid-Day Market Update: Avis Budget Surges After Q3 Results; Chegg Shares Plunge', ""51 Stocks Moving In Tuesday's Mid-Day Session"", 'DuPont to buy engineered materials maker Rogers Corp. for $5.2B, divest of mobility unit', 'DuPont To Acquire Rogers At 33% Premium', 'Rogers Corp. (ROG) Q3 Earnings and Revenues Lag Estimates', 'DuPont stock drops after earnings beat but outlook cut, and after $5.2 billion Rogers buyout deal', 'Rogers stock rockets into record territory after $5.2 billion buyout deal with DuPont', 'UPDATE 1-DuPont to buy engineering materials maker Rogers for $5.2 bln', 'Rogers Corporation Reports Third Quarter 2021 Results', 'DuPont seeks electronic materials muscle with $5.2 billion Rogers deal', 'DuPont Reports Third Quarter 2021 Results', 'DuPont Announces Acquisition of Rogers Corporation', 'DuPont Announces Strategic Actions to Enhance Portfolio for Near and Long-term Value Creation', 'DuPont Slumps on Fresh Bout of Corporate Reconstruction', 'DuPont Buys Rogers Corp. For $5.2 Billion, Tops Q3 Earnings Forecast, Lowers 2021 Guidance']","['https://finance.yahoo.com/news/rogers-corporation-investor-alert-former-233100758.html', 'https://finance.yahoo.com/news/rogers-alert-bragar-eagel-squire-221600052.html', 'https://www.marketwatch.com/story/dupont-beats-profit-forecast-but-cuts-outlook-and-announces-5-2-billion-buyout-of-rogers-corp-11635867318?siteid=yhoof2', 'https://finance.yahoo.com/news/mid-afternoon-market-dow-rises-183200464.html', 'https://finance.yahoo.com/news/dupont-offers-275-share-rogers-011322004.html', 'https://www.fool.com/investing/2021/11/02/why-rogers-shares-are-soaring-today/?source=eptyholnk0000202&utm_source=yahoo-host&utm_medium=feed&utm_campaign=article', 'https://finance.yahoo.com/news/shareholder-alert-ademi-llp-investigates-164900929.html', 'https://finance.yahoo.com/news/rogers-merger-investigation-halper-sadeh-161100808.html', 'https://finance.yahoo.com/news/mid-day-market-avis-budget-160855070.html', 'https://finance.yahoo.com/news/51-stocks-moving-tuesdays-mid-160613840.html', 'https://www.bizjournals.com/philadelphia/news/2021/11/02/dupont-rogers-acquisition-divest.html?ana=yahoo', 'https://finance.yahoo.com/news/dupont-acquire-rogers-33-premium-115809669.html', 'https://finance.yahoo.com/news/rogers-corp-rog-q3-earnings-112511120.html', 'https://www.marketwatch.com/story/dupont-stock-drops-after-earnings-beat-but-outlook-cut-and-after-52-billion-rogers-buyout-deal-2021-11-02?siteid=yhoof2', 'https://www.marketwatch.com/story/rogers-stock-rockets-into-record-territory-after-52-billion-buyout-deal-with-dupont-2021-11-02?siteid=yhoof2', 'https://finance.yahoo.com/news/1-dupont-buy-engineering-materials-101318557.html', 'https://finance.yahoo.com/news/rogers-corporation-reports-third-quarter-100500950.html', 'https://finance.yahoo.com/news/dupont-buy-engineering-materials-maker-100444206.html', 'https://finance.yahoo.com/news/dupont-reports-third-quarter-2021-100000846.html', 'https://finance.yahoo.com/news/dupont-announces-acquisition-rogers-corporation-100000130.html', 'https://finance.yahoo.com/news/dupont-announces-strategic-actions-enhance-095900977.html', 'https://finance.yahoo.com/news/dupont-slumps-plans-fresh-bout-064546130.html', 'https://www.thestreet.com/markets/dupont-buys-rogers-for-5-2-billion-tops-q3-earnings-forecast?puc=yahoo&cm_ven=YAHOO']"
1355,rog,2021-11-03,269.8,269.36,269.5,"['SHAREHOLDER ALERT: Rigrodsky Law, P.A. Announces Investigation of Rogers Corporation Merger', 'SHAREHOLDER ALERT: Levi & Korsinsky, LLP Notifies Investors of an Investigation into the Fairness of the Sale of Rogers Corporation to DuPont de Nemours, Inc.']","['https://finance.yahoo.com/news/shareholder-alert-rigrodsky-law-p-155000243.html', 'https://finance.yahoo.com/news/shareholder-alert-levi-korsinsky-llp-135300201.html']"
1356,rog,2021-11-04,269.36,269.5,269.87,"['SHAREHOLDER INVESTIGATION: Halper Sadeh LLP Investigates ROG, RRD, XLRN, ADMS; Shareholders are Encouraged to Contact the Firm', 'Why Rogers Corporation (NYSE:ROG) Could Be Worth Watching', 'Lifshitz Law Firm, P.C. Announces Investigation of CXP, ECHO, KRA and ROG']","['https://finance.yahoo.com/news/shareholder-investigation-halper-sadeh-llp-225600841.html', 'https://finance.yahoo.com/news/why-rogers-corporation-nyse-rog-191132735.html', 'https://finance.yahoo.com/news/lifshitz-law-firm-p-c-150500526.html']"
1357,rog,2021-11-05,269.5,269.87,269.87,['Why DuPont and Rogers Stocks Blasted Higher This Week'],['https://www.fool.com/investing/2021/11/05/why-dupont-rogers-stocks-blasted-higher-this-week/?source=eptyholnk0000202&utm_source=yahoo-host&utm_medium=feed&utm_campaign=article']
1358,rog,2021-11-08,269.87,269.55,269.19,"['Lifshitz Law Firm, P.C. Announces Investigation of CXP, ICLK, KRA and ROG']",['https://finance.yahoo.com/news/lifshitz-law-firm-p-c-164100007.html']
1359,rog,2021-11-09,269.55,269.19,269.58,"['MERGER ALERT  ZEN, ROG, and PAE: Levi & Korsinsky, LLP Reminds Investors of Investigations Concerning the Mergers of these Companies', 'SHAREHOLDER INVESTIGATION: Halper Sadeh LLP is Investigating the Following Companies - ROG, TSC, CPLG, RRD, AZPN']","['https://finance.yahoo.com/news/merger-alert-zen-rog-pae-213000126.html', 'https://finance.yahoo.com/news/shareholder-investigation-halper-sadeh-llp-181000285.html']"
1360,rog,2021-11-10,269.19,269.58,269.77,"['SHAREHOLDER ALERT: WeissLaw LLP Reminds ROG, RRD, MNR, and HRC Shareholders About Its Ongoing Investigations', 'SHAREHOLDER INVESTIGATION: Halper Sadeh LLP Investigates ZEN, ROG, RRD, PTRS; Shareholders are Encouraged to Contact the Firm']","['https://finance.yahoo.com/news/shareholder-alert-weisslaw-llp-reminds-233100976.html', 'https://finance.yahoo.com/news/shareholder-investigation-halper-sadeh-llp-162200057.html']"
1361,rog,2021-11-11,269.58,269.77,269.83,"['SHAREHOLDER INVESTIGATION: Halper Sadeh LLP Investigates ROG, RRD, CPLG, ABTX; Shareholders are Encouraged to Contact the Firm', 'Lifshitz Law Firm, P.C. Announces Investigation of CPLG, KRA, ROG, and ZIXI']","['https://finance.yahoo.com/news/shareholder-investigation-halper-sadeh-llp-172100273.html', 'https://finance.yahoo.com/news/lifshitz-law-firm-p-c-160600401.html']"
1362,rog,2021-11-15,269.83,270.04,270.06,"['Lifshitz Law Firm, P.C. Announces Investigation of CPLG, KRA, ROG, and ZIXI']",['https://finance.yahoo.com/news/lifshitz-law-firm-p-c-200000387.html']
1363,rog,2021-11-16,270.04,270.06,269.94,"['SHAREHOLDER INVESTIGATION: Halper Sadeh LLP Investigates ROG, PAE, MNTV, GWB; Shareholders are Encouraged to Contact the Firm']",['https://finance.yahoo.com/news/shareholder-investigation-halper-sadeh-llp-140000906.html']
1364,rog,2021-11-17,270.06,269.94,270.06,"['SHAREHOLDER NOTICE: Brodsky & Smith Announces an Investigation of Rogers Corporation (NYSE:ROG)', 'SHAREHOLDER INVESTIGATION: Halper Sadeh LLP Investigates ROG, CPLG, LEVL, ZIXI; Shareholders are Encouraged to Contact the Firm', 'Lifshitz Law Firm, P.C. Announces Investigation of CPLG, KRA, ROG, and ZIXI']","['https://finance.yahoo.com/news/shareholder-notice-brodsky-smith-announces-230300373.html', 'https://finance.yahoo.com/news/shareholder-investigation-halper-sadeh-llp-172500905.html', 'https://finance.yahoo.com/news/lifshitz-law-firm-p-c-151500276.html']"
1365,rog,2021-11-18,269.94,270.06,270.32,"['MERGER ALERT - ROG, IHC, and NE: Levi & Korsinsky, LLP Reminds Investors of Investigations Concerning the Mergers of these Companies', 'INVESTIGATION ALERT: Halper Sadeh LLP Investigates TSC, ROG, RRD, GWB; Shareholders are Encouraged to Contact the Firm', 'Lifshitz Law Firm, P.C. Announces Investigation of CSPR, CPLG, KRA, and ROG']","['https://finance.yahoo.com/news/merger-alert-rog-ihc-ne-222500267.html', 'https://finance.yahoo.com/news/investigation-alert-halper-sadeh-llp-183000932.html', 'https://finance.yahoo.com/news/lifshitz-law-firm-p-c-165900557.html']"
1366,rog,2021-11-19,270.06,270.32,270.32,"['ROGERS ALERT: Bragar Eagel & Squire, P.C. Reminds Investors of its Investigation of the Sale of ROG and Encourages Investors to Contact the Firm', 'NOTICE - IMPORTANT SHAREHOLDER INVESTIGATION UPDATE: Brodsky & Smith Reminds Investors of Investigations Related to the Following Companies: Rogers Corporation (NYSE - ROG), Independence Holding Company (NYSE  IHC), Aspen Technology, Inc. (Nasdaq - AZPN)', 'SHAREHOLDER ALERT: WeissLaw LLP Reminds CPLG, MNTV, ROG, and KRA Shareholders About Its Ongoing Investigations']","['https://finance.yahoo.com/news/rogers-alert-bragar-eagel-squire-020000987.html', 'https://finance.yahoo.com/news/notice-important-shareholder-investigation-brodsky-192000702.html', 'https://finance.yahoo.com/news/shareholder-alert-weisslaw-llp-reminds-130000368.html']"
1367,rog,2021-11-22,270.32,270.1,271.5,"['SHAREHOLDER INVESTIGATION: Halper Sadeh LLP Investigates ROG, PTRS, NPTN, ZEN; Shareholders are Encouraged to Contact the Firm', 'NOTICE - IMPORTANT SHAREHOLDER INVESTIGATION UPDATE: Brodsky & Smith Reminds Investors of Investigations Related to the Following Companies: Dicerna Pharmaceuticals, Inc. Corporation (Nasdaq  DRNA), Rogers Corporation (NYSE - ROG), Independence Holding Company (NYSE  IHC)', 'Lifshitz Law Firm, P.C. Announces Investigation of HLXA, ROG, RRD, and TSC', 'ROGERS CORPORATION INVESTOR ALERT BY THE FORMER ATTORNEY GENERAL OF LOUISIANA: Kahn Swick & Foti, LLC Investigates Adequacy of Price and Process in Proposed Sale of Rogers Corporation (NYSE:ROG)', 'INVESTIGATION ALERT: Halper Sadeh LLP Investigates HFC, PAE, ROG, KRA; Shareholders are Encouraged to Contact the Firm']","['https://finance.yahoo.com/news/shareholder-investigation-halper-sadeh-llp-230200865.html', 'https://finance.yahoo.com/news/notice-important-shareholder-investigation-brodsky-220000116.html', 'https://finance.yahoo.com/news/lifshitz-law-firm-p-c-153000831.html', 'https://finance.yahoo.com/news/rogers-corporation-investor-alert-former-053200033.html', 'https://finance.yahoo.com/news/investigation-alert-halper-sadeh-llp-050000904.html']"
1368,rog,2021-11-23,270.1,271.5,271.48,"['SHAREHOLDER INVESTIGATION: Halper Sadeh LLP Investigates TSC, ROG, RRD, PTRS; Shareholders are Encouraged to Contact the Firm', 'Lifshitz Law Firm, P.C. Announces Investigation of ROG, RRD, STXB, and TSC']","['https://finance.yahoo.com/news/shareholder-investigation-halper-sadeh-llp-185100658.html', 'https://finance.yahoo.com/news/lifshitz-law-firm-p-c-162000707.html']"
1369,rog,2021-11-25,270.35,271.48,271.48,"['Lifshitz Law Firm, P.C. Announces Investigation of FWSA, ROG, RRD, and TSC']",['https://finance.yahoo.com/news/lifshitz-law-firm-p-c-180200939.html']
1370,rog,2021-11-26,270.35,271.48,271.48,"['SHAREHOLDER ALERT: Halper Sadeh LLP Investigates GWB, TSC, ROG, PTRS; Shareholders are Encouraged to Contact the Firm']",['https://finance.yahoo.com/news/shareholder-alert-halper-sadeh-llp-140000533.html']
1371,rog,2021-11-29,271.48,272.62,271.0,"['URGENT: The M&A Firm is Investigating the Sale of Rogers Corp. - ROG', 'SHAREHOLDER INVESTIGATION: Halper Sadeh LLP Investigates ROG, PTRS, VG, GWB; Shareholders are Encouraged to Contact the Firm', 'Lifshitz Law Firm, P.C. Announces Investigation of ROG, RRD, TSC, and VG']","['https://finance.yahoo.com/news/urgent-m-firm-investigating-sale-015000019.html', 'https://finance.yahoo.com/news/shareholder-investigation-halper-sadeh-llp-231500640.html', 'https://finance.yahoo.com/news/lifshitz-law-firm-p-c-162500826.html']"
1372,rog,2021-11-30,272.62,271.0,271.0,"['SHAREHOLDER ALERT: WeissLaw LLP Reminds VG, GDP, CPLG, and ROG Shareholders About Its Ongoing Investigations', 'SHAREHOLDER ALERT: Rigrodsky Law, P.A. Reminds Investors of Investigation of DVD, NPTN, RRD, and ROG Buyouts', 'SHAREHOLDER INVESTIGATION: Halper Sadeh LLP Investigates GSKY, ESBK, FTSI, ROG; Shareholders are Encouraged to Contact the Firm', 'SHAREHOLDER NOTICE: Brodsky & Smith Announces an Investigation of Rogers Corporation (NYSE - ROG)']","['https://finance.yahoo.com/news/shareholder-alert-weisslaw-llp-reminds-025700530.html', 'https://finance.yahoo.com/news/shareholder-alert-rigrodsky-law-p-210000845.html', 'https://finance.yahoo.com/news/shareholder-investigation-halper-sadeh-llp-204000272.html', 'https://finance.yahoo.com/news/shareholder-notice-brodsky-smith-announces-150000308.html']"
1373,rog,2021-12-01,271.0,271.0,272.56,"['Lifshitz Law Firm, P.C. Announces Investigation of ROG, RRD, TSC, and VG', 'Rogers Merger Investigation: Halper Sadeh LLP Announces Investigation Into Whether the Sale of Rogers Corporation Is Fair to Shareholders; Investors Are Encouraged To Contact the Firm  ROG']","['https://finance.yahoo.com/news/lifshitz-law-firm-p-c-174600509.html', 'https://finance.yahoo.com/news/rogers-merger-investigation-halper-sadeh-050000337.html']"
1374,rog,2021-12-02,271.0,272.56,272.0,"['Moore Kuehn Encourages ASPC, ROG, DRNA, and VG Investors to Contact Law Firm', 'ROGERS MERGER INVESTIGATION: Halper Sadeh LLP Announces Investigation Into Whether The Sale Of Rogers Corporation Is Fair To Shareholders; Investors Are Encouraged To Contact The Firm - ROG']","['https://finance.yahoo.com/news/moore-kuehn-encourages-aspc-rog-164700988.html', 'https://finance.yahoo.com/news/rogers-merger-investigation-halper-sadeh-144000857.html']"
1375,rog,2021-12-03,272.56,272.0,272.0,"['ROGERS ALERT: Bragar Eagel & Squire, P.C. Reminds Investors of its Investigation of the Sale of ROG and Encourages Investors to Contact the Firm', 'SHAREHOLDER NOTICE: Brodsky & Smith Announces an Investigation of Rogers Corporation (NYSE:ROG)']","['https://finance.yahoo.com/news/rogers-alert-bragar-eagel-squire-220700703.html', 'https://finance.yahoo.com/news/shareholder-notice-brodsky-smith-announces-203000651.html']"
1376,rog,2021-12-06,272.0,271.22,272.26,"['Oakmark International Fund Buys Prosus NV, Worldline SA, Vipshop Holdings, Sells Naspers, ...', 'SHAREHOLDER INVESTIGATION: Halper Sadeh LLP Investigates ROG, NPTN, CPLG, ABTX; Shareholders are Encouraged to Contact the Firm', 'Lifshitz Law Firm, P.C. Announces Investigation of ROG, RRD, TSC, and VG', 'ACT NOW: The M&A Class Action Firm Continues to Investigate the Sale of Rogers Corp.  ROG', 'SHAREHOLDER INVESTIGATION: Halper Sadeh LLP Investigates ADTN, ROG, VG, DRNA; Shareholders are Encouraged to Contact the Firm']","['https://finance.yahoo.com/news/oakmark-international-fund-buys-prosus-223802635.html', 'https://finance.yahoo.com/news/shareholder-investigation-halper-sadeh-llp-183200113.html', 'https://finance.yahoo.com/news/lifshitz-law-firm-p-c-153000214.html', 'https://finance.yahoo.com/news/act-now-m-class-action-210000065.html', 'https://finance.yahoo.com/news/shareholder-investigation-halper-sadeh-llp-161600569.html']"
1377,rog,2021-12-07,271.22,272.26,271.8,"['Shareholder Alert: The M&A Class Action Firm is Investigating the Sale of Rogers Corp. - ROG', 'SHAREHOLDER NOTICE: Brodsky & Smith Announces an Investigation of Rogers Corporation (NYSE - ROG)', 'Mercer Funds Buys Dassault Systemes SE, Icon PLC, Koninklijke DSM NV, Sells Safran SA, ASOS ...']","['https://finance.yahoo.com/news/shareholder-alert-m-class-action-232000711.html', 'https://finance.yahoo.com/news/shareholder-notice-brodsky-smith-announces-213000521.html', 'https://finance.yahoo.com/news/mercer-funds-buys-dassault-systemes-173803757.html']"
1378,rog,2021-12-08,272.26,271.8,271.48,"[""O'Shares Europe Quality Dividend ETF Buys Roche Holding AG, Nestle SA, LVMH Moet Hennessy Louis ...""]",['https://finance.yahoo.com/news/oshares-europe-quality-dividend-etf-153805821.html']
1379,rog,2021-12-09,271.8,271.48,271.25,"['PF Small-Cap Growth Fund Buys Paycor HCM Inc, Thoughtworks Holding Inc, Innovative Industrial ...', 'SHAREHOLDER INVESTIGATION: Halper Sadeh LLP Investigates the Following Companies - ROG, PAE, MNTV, CSPR, VLY, DRNA']","['https://finance.yahoo.com/news/pf-small-cap-growth-fund-223804694.html', 'https://finance.yahoo.com/news/shareholder-investigation-halper-sadeh-llp-191800139.html']"
1380,rog,2021-12-10,271.48,271.25,271.25,['SHAREHOLDER NOTICE: Brodsky & Smith Announces an Investigation of Rogers Corporation (NYSE - ROG)'],['https://finance.yahoo.com/news/shareholder-notice-brodsky-smith-announces-020300089.html']
1381,rog,2021-12-13,271.25,271.3,270.59,"['DWS CROCI(R) International VIP Buys Roche Holding AG, Novartis AG, Tokyo Electron, Sells Novo ...', 'SHAREHOLDER ALERT: The M&A Class Action Firm Continues to Investigate the Merger', 'SHAREHOLDER INVESTIGATION: Halper Sadeh LLP Investigates ROG, SLRC, MIME; Shareholders are Encouraged to Contact the Firm', 'Penn Series Small Cap Growth Fund Buys Core & Main Inc, Clear Secure Inc, Inotiv Inc, Sells ...', 'Delaware Group Equity Funds Iv Buys Knorr-Bremse AG, Clorox Co, Smith & Nephew PLC, Sells ...', 'Delaware Group Foundation Funds Buys Commonwealth Bank of Australia, AXA SA, Roche Holding AG, ...']","['https://finance.yahoo.com/news/dws-croci-r-international-vip-223805587.html', 'https://finance.yahoo.com/news/shareholder-alert-m-class-action-172400988.html', 'https://finance.yahoo.com/news/shareholder-investigation-halper-sadeh-llp-171500457.html', 'https://finance.yahoo.com/news/penn-series-small-cap-growth-103808102.html', 'https://finance.yahoo.com/news/delaware-group-equity-funds-iv-083801700.html', 'https://finance.yahoo.com/news/delaware-group-foundation-funds-buys-063803784.html']"
1382,rog,2021-12-14,271.3,270.59,270.2,"['Principal International Multi-Factor ETF Buys Dassault Systemes SE, Universal Music Group NV, ...', 'SHAREHOLDER INVESTIGATION: Halper Sadeh LLP Investigates ROG, RRD, MIME, UMPQ; Shareholders are Encouraged to Contact the Firm']","['https://finance.yahoo.com/news/principal-international-multi-factor-etf-163806541.html', 'https://finance.yahoo.com/news/shareholder-investigation-halper-sadeh-llp-050000773.html']"
1383,rog,2021-12-15,270.59,270.2,269.0,"['ROGERS MERGER INVESTIGATION: Halper Sadeh LLP Announces Investigation into Whether the Sale of Rogers Corporation Is Fair to Shareholders; Investors Are Encouraged to Contact the Firm - ROG', 'Lifshitz Law Firm, P.C. Announces Investigation of ESBK, ROG, TSC, and VG']","['https://finance.yahoo.com/news/rogers-merger-investigation-halper-sadeh-181000602.html', 'https://finance.yahoo.com/news/lifshitz-law-firm-p-c-154900295.html']"
1384,rog,2021-12-17,269.0,270.37,270.37,"['Royce Global Value Trust, Inc. Buys Rogers Corp, Element Solutions Inc, Imax Corp']",['https://finance.yahoo.com/news/royce-global-value-trust-inc-083803499.html']
1385,se,2021-10-12,324.9,349.35,345.37,['10 Tech Stocks to Buy According to Billionaire James Dinan'],['https://finance.yahoo.com/news/10-tech-stocks-buy-according-170433359.html']
1386,se,2021-10-13,349.35,345.37,354.5,"['Why MercadoLibre Is a Compelling E-Commerce Stock', 'Sea Limited Bounces Off 50-Day Line', '3 Strong Tier 1 Companies to Keep an Eye On', 'Facebook, Lazada Told to Stop Text-Blaster Sales in Philippines', 'Top 10 SPACs to Buy According to Richard Gersons Falcon Edge Capital']","['https://www.fool.com/investing/2021/10/13/why-mercadolibre-is-a-compelling-e-commerce-stock/?source=eptyholnk0000202&utm_source=yahoo-host&utm_medium=feed&utm_campaign=article', 'https://finance.yahoo.com/video/sea-limited-bounces-off-50-163003101.html', 'https://www.fool.com/investing/2021/10/13/3-strong-tier-1-companies-to-keep-an-eye-on/?source=eptyholnk0000202&utm_source=yahoo-host&utm_medium=feed&utm_campaign=article', 'https://finance.yahoo.com/news/facebook-lazada-told-stop-philippines-100937049.html', 'https://finance.yahoo.com/news/top-10-spacs-buy-according-090923809.html']"
1387,se,2021-10-14,345.37,354.5,357.09,"['Sea Limited Sponsored ADR (SE) Stock Sinks As Market Gains: What You Should Know', 'Dow Jones Futures Signal Market Rally On Falling Yields, Strong Earnings; AMD Leads 5 Stocks Flashing Buy Signals', ""4 Unstoppable Stocks to Buy If There's a Stock Market Crash""]","['https://finance.yahoo.com/news/sea-limited-sponsored-adr-se-215009781.html', 'https://www.investors.com/market-trend/stock-market-today/dow-jones-futures-market-rally-attempt-does-this-amd-leads-stocks-flashing-buy-signals/?src=A00220', 'https://www.fool.com/investing/2021/10/14/4-unstoppable-stocks-to-buy-if-stock-market-crash/?source=eptyholnk0000202&utm_source=yahoo-host&utm_medium=feed&utm_campaign=article']"
1388,se,2021-10-15,354.5,357.09,357.09,"['3 E-Commerce Stocks You Can Buy and Hold for the Next Decade', '5 Big-Name Stocks Expected to Increase Sales 356% to 1,605% by 2025']","['https://www.fool.com/investing/2021/10/15/e-commerce-stocks-buy-and-hold-for-next-decade/?source=eptyholnk0000202&utm_source=yahoo-host&utm_medium=feed&utm_campaign=article', 'https://www.fool.com/investing/2021/10/15/5-big-name-stocks-increase-sales-356-to-1605/?source=eptyholnk0000202&utm_source=yahoo-host&utm_medium=feed&utm_campaign=article']"
1389,se,2021-10-18,357.09,366.99,360.6,"['Why Sea Limited Could Be a Top Growth Stock for the Long Term', '2 Leading International Stocks to Buy in 2021']","['https://www.fool.com/investing/2021/10/16/why-sea-ltd-could-be-a-top-growth-stock-for-the-lo/?source=eptyholnk0000202&utm_source=yahoo-host&utm_medium=feed&utm_campaign=article', 'https://www.fool.com/investing/2021/10/16/2-leading-international-stocks-to-buy-in-2021/?source=eptyholnk0000202&utm_source=yahoo-host&utm_medium=feed&utm_campaign=article']"
1390,se,2021-10-19,366.99,360.6,363.3,['Prediction: These Will Be 5 of the Biggest Stocks by 2040'],['https://www.fool.com/investing/2021/10/19/prediction-these-will-be-5-biggest-stocks-by-2040/?source=eptyholnk0000202&utm_source=yahoo-host&utm_medium=feed&utm_campaign=article']
1391,se,2021-10-20,360.6,363.3,355.3,['Sea Limited Sponsored ADR (SE) Stock Sinks As Market Gains: What You Should Know'],['https://finance.yahoo.com/news/sea-limited-sponsored-adr-se-215009164.html']
1392,se,2021-10-21,363.3,355.3,348.32,['3 Top Cathie Wood Stocks to Buy Right Now'],['https://www.fool.com/investing/2021/10/21/3-top-cathie-wood-stocks-to-buy-right-now/?source=eptyholnk0000202&utm_source=yahoo-host&utm_medium=feed&utm_campaign=article']
1393,se,2021-10-25,348.32,343.57,340.17,['10 Tech Stocks to Invest in Today According to John Armitages Egerton Capital'],['https://finance.yahoo.com/news/10-tech-stocks-invest-today-075714845.html']
1394,se,2021-10-26,343.57,340.17,352.73,"['Sea Limited Sponsored ADR (SE) Stock Sinks As Market Gains: What You Should Know', '10 Tech Stocks to Buy According to Billionaire Philippe Laffont']","['https://finance.yahoo.com/news/sea-limited-sponsored-adr-se-215009444.html', 'https://finance.yahoo.com/news/10-tech-stocks-buy-according-134400821.html']"
1395,se,2021-10-27,340.17,352.73,343.57,['Sea Limited Sponsored ADR (SE) Dips More Than Broader Markets: What You Should Know'],['https://finance.yahoo.com/news/sea-limited-sponsored-adr-se-214509230.html']
1396,se,2021-10-28,352.73,343.57,354.04,['Will Sea Limited Ever Be Profitable?'],['https://www.fool.com/investing/2021/10/28/will-sea-limited-ever-be-profitable/?source=eptyholnk0000202&utm_source=yahoo-host&utm_medium=feed&utm_campaign=article']
1397,se,2021-10-29,343.57,354.04,354.04,"['SE Stock: Another Swing Trading Success On The Second Try', '3 Growth Stocks Likely to Trounce Shiba Inu Over the Next 5 Years', 'Carl Andersons Marcho Partners Is Investing In These 10 Stocks']","['https://www.investors.com/research/swing-trading/se-stock-another-swing-trading-success-on-the-second-try/?src=A00220', 'https://www.fool.com/investing/2021/10/29/3-growth-stocks-likely-to-trounce-shiba-inu-over-t/?source=eptyholnk0000202&utm_source=yahoo-host&utm_medium=feed&utm_campaign=article', 'https://finance.yahoo.com/news/carl-anderson-marcho-partners-investing-092926873.html']"
1398,se,2021-11-01,354.04,360.23,353.66,"['Some Prices Are Getting Cheaper -- How to Ride the Tech-Deflation Wave', 'Were Hedge Funds Right About Sea Limited (SE)?']","['https://www.fool.com/investing/2021/11/01/some-prices-are-getting-cheaper-how-to-ride-the-te/?source=eptyholnk0000202&utm_source=yahoo-host&utm_medium=feed&utm_campaign=article', 'https://finance.yahoo.com/news/were-hedge-funds-sea-limited-145136266.html']"
1399,se,2021-11-02,360.23,353.66,356.95,"['Sea Limited Sponsored ADR (SE) Outpaces Stock Market Gains: What You Should Know', 'Sea Limited to Report Third Quarter 2021 Results']","['https://finance.yahoo.com/news/sea-limited-sponsored-adr-se-214509841.html', 'https://finance.yahoo.com/news/sea-limited-report-third-quarter-070100568.html']"
1400,se,2021-11-03,353.66,356.95,357.78,['10 Best Fintech Stocks To Buy Now'],['https://finance.yahoo.com/news/10-best-fintech-stocks-buy-150451109.html']
