,Ticker,Today Date,Today Close,Next Day Close,Next Next Day Close,Headline,Link
0,aapl,2021-12-14,174.33,179.3,172.26,"['Warren Buffett says these are the absolute best stocks to own  check out 3 choice picks from his collection', 'Dow Jones Falls; Tesla Stock Slips On Elon Musk Move; Senate Approves Debt Ceiling Hike', 'US STOCKS-Wall Street ends down, investors eye inflation and Omicron', 'US STOCKS-Wall Street ends down; investors eye inflation and Omicron', 'Duolingo adds former Mozilla CEO John Lilly to its board of directors', 'Apple Restores Mask Mandate for All U.S. Stores', 'US STOCKS-Wall Street drops as investors eye inflation and coronavirus', 'Apple stock dips, software stocks slump, AMC and GME remain volatile', 'Why Apple Stock Dropped Today', 'Apples augmented-reality ambitions could be a game changer, Bank of America says in upgrade', 'UPDATE 1-Apple makes masks mandatory at U.S. retail stores as COVID-19 cases rise', '5 Dow Jones Stocks To Buy And Watch In December 2021: Apple, Microsoft Sell Off', 'Politician says Germany should ban Telegram unless it tackles extremist content', 'Apple to Again Require Masks at U.S. Stores and Limit Crowds', 'Stocks in defensive setup ahead of Fed announcement', 'Apple makes masks mandatory at U.S. retail stores as COVID-19 cases rise', 'Newfound Risk Managed US Sectors Fund Buys Vanguard S&P 500 ETF, Vanguard U.S. ...', 'Dow Falls As Apple, Microsoft Weigh; Nasdaq Loses Support As Growth Stocks Sell Off', 'Principal Exchange-Traded Funds Buys Apple Inc, Microsoft Corp, Amazon.com Inc, Sells ,', 'The Worst Mistake Roku Investors Can Make Right Now']","['https://finance.yahoo.com/news/warren-buffett-says-absolute-best-230500742.html', 'https://www.investors.com/market-trend/stock-market-today/dow-jones-dips-as-microsoft-stock-falls-tesla-stock-slips-on-elon-musk-move-chuck-schumer-debt-ceiling-push/?src=A00220', 'https://finance.yahoo.com/news/us-stocks-wall-street-ends-211020146.html', 'https://finance.yahoo.com/news/us-stocks-wall-street-ends-210032586.html', 'https://www.bizjournals.com/pittsburgh/news/2021/12/14/duolingo-adds-former-mozilla-ceo-to-board.html?ana=yahoo', 'https://www.barrons.com/articles/apple-stock-covid-mask-mandate-51639512379?siteid=yhoof2', 'https://finance.yahoo.com/news/us-stocks-wall-street-drops-195422417.html', 'https://finance.yahoo.com/video/apple-stock-dips-software-stocks-193649208.html', 'https://www.fool.com/investing/2021/12/14/why-apple-stock-dropped-today/?source=eptyholnk0000202&utm_source=yahoo-host&utm_medium=feed&utm_campaign=article', 'https://www.marketwatch.com/story/apples-augmented-reality-ambitions-could-be-a-game-changer-bank-of-america-says-in-upgrade-11639507302?siteid=yhoof2', 'https://finance.yahoo.com/news/1-apple-makes-masks-mandatory-182753808.html', 'https://www.investors.com/research/dow-jones-stocks/?src=A00220', 'https://finance.yahoo.com/news/politician-says-germany-ban-telegram-182425224.html', 'https://finance.yahoo.com/news/apple-again-require-masks-u-173703128.html', 'https://finance.yahoo.com/video/stocks-defensive-setup-ahead-fed-181118436.html', 'https://finance.yahoo.com/news/apple-asks-customers-employees-wear-175811231.html', 'https://finance.yahoo.com/news/newfound-risk-managed-us-sectors-173801180.html', 'https://www.investors.com/market-trend/stock-market-today/dow-jones-falls-apple-microsoft-weigh-nasdaq-loses-support-growth-stocks-sell-off/?src=A00220', 'https://finance.yahoo.com/news/principal-exchange-traded-funds-buys-163803809.html', 'https://www.fool.com/investing/2021/12/14/worst-mistake-roku-investors-can-make-right-now/?source=eptyholnk0000202&utm_source=yahoo-host&utm_medium=feed&utm_campaign=article']"
1,aapl,2021-12-15,179.3,172.26,171.14,"['Why Apple Stock Rallied Today', 'Apple Scraps Office-Return Deadline Without Setting New Date', 'Apple Delays Office Return; Germany Rations Shots: Virus Update', 'Top 10 Stocks to Buy According to Legendary Value Investor Joel Greenblatt', '10 Best Value Stocks in Warren Buffetts Portfolio', 'UPDATE 4-Apple delays return to office indefinitely - Bloomberg News', 'Apple delays return to office indefinitely - Bloomberg News', 'Why analysts love Apple right now', 'Apple is close to hitting $3T  now it has to prove investors made the right call', 'Apple: A big driver of the iPhone 5G upgrade cycle will be switchers, analyst says', 'As Tech Stocks Struggle in a Volatile Market, Is Apple a Good Stock to Buy Right Now?', 'Disney Plus Now Supports Apple SharePlay, Letting You Watch Shows and Movies With up to 32 People', 'Apple Products Still On Sale For Your Last-Minute Gifting Needs', 'What to Watch in 2022', 'Market check: Stocks drift as traders await Fed decision', 'Misinformation Has Already Made Its Way to the Metaverse', 'Dow Jones Futures: Stock Market At Turning Point As Fed Decision Looms; Google, Tesla, Nvidia At Key Levels', 'Apple Set to Post Strong 2022 Returns', 'Stock market news live updates: Stock futures drift ahead of Fed decision', 'Will Apple Hit a $3 Trillion Market Cap in 2022?', ""Warren Buffett Stocks: What's Inside Berkshire Hathaway's Portfolio?"", 'Apple Has Some Surprising News About the Mac and iPad', 'Samsung Gets Competition in Foldables From a $1,250 China Phone', 'Biden Team Mulls New Clampdown on Chinas Largest Chipmaker']","['https://www.fool.com/investing/2021/12/15/why-apple-stock-rallied-today/?source=eptyholnk0000202&utm_source=yahoo-host&utm_medium=feed&utm_campaign=article', 'https://finance.yahoo.com/news/apple-delays-return-office-until-215650831.html', 'https://finance.yahoo.com/news/issues-omicron-warning-strain-spreads-225553568.html', 'https://finance.yahoo.com/news/top-10-stocks-buy-according-210153567.html', 'https://finance.yahoo.com/news/10-best-value-stocks-warren-200941655.html', 'https://finance.yahoo.com/news/1-apple-shuts-stores-miami-195015547.html', 'https://finance.yahoo.com/news/apple-shuts-stores-miami-ottawa-194629028.html', 'https://finance.yahoo.com/video/why-analysts-love-apple-now-190515751.html', 'https://finance.yahoo.com/news/apple-is-close-to-hitting-3t-now-it-has-to-prove-investors-made-the-right-call-174350266.html', 'https://finance.yahoo.com/video/apple-big-driver-iphone-5g-162233751.html', 'https://www.fool.com/investing/2021/12/15/as-tech-stocks-struggle-in-a-volatile-market-is-ap/?source=eptyholnk0000202&utm_source=yahoo-host&utm_medium=feed&utm_campaign=article', 'https://finance.yahoo.com/news/disney-plus-now-supports-apple-153144627.html', 'https://www.thestreet.com/personal-finance/apple-products-on-sale-amazon-december-2021-tst-deals?puc=yahoo&cm_ven=YAHOO', 'https://www.investopedia.com/what-to-watch-in-2022-5208012?utm_campaign=quote-yahoo&utm_source=yahoo&utm_medium=referral', 'https://finance.yahoo.com/video/market-check-stocks-drift-traders-145835086.html', 'https://finance.yahoo.com/news/misinformation-already-made-way-metaverse-140017623.html', 'https://www.investors.com/market-trend/stock-market-today/dow-jones-futures-stock-market-at-turning-point-fed-decision-looms-microsoft-google-tesla-nvidia-at-key-levels/?src=A00220', 'https://finance.yahoo.com/news/apple-set-post-strong-2022-123428502.html', 'https://finance.yahoo.com/news/stock-market-news-live-updates-december-14-2021-233411115.html', 'https://www.fool.com/investing/2021/12/15/will-apple-hit-a-3-trillion-market-cap-in-2022/?source=eptyholnk0000202&utm_source=yahoo-host&utm_medium=feed&utm_campaign=article', 'https://www.investors.com/research/warren-buffett-stocks/?src=A00220', 'https://www.thestreet.com/technology/apple-has-some-surprising-news-about-the-mac-and-ipad?puc=yahoo&cm_ven=YAHOO', 'https://finance.yahoo.com/news/samsung-gets-competition-foldables-1-093000071.html', 'https://finance.yahoo.com/news/biden-team-considers-clampdown-china-231703320.html']"
2,aapl,2021-12-16,172.26,171.14,169.75,"['Apple Stock Fell 3.5% Thursday. What Was Behind the Slide.', 'Is The Trade Desk a Good Stock to Buy Despite Its Nosebleed Valuation?', 'Apple Shares Slide on Rate Fears', 'Dow Jones Dips As Fed Rally Falters; Adobe Stock Plummets On This; Tesla Stalls As Ford Gains', 'Apple Leads Big Tech Lower as Investors Reconsider Fed Moves', 'Meta Cracks Down on Companies That Spied\xa0on Users in 100 Countries', 'Why AMD, Qualcomm, and Skyworks Stocks Just Crashed', ""These companies' values soared since the start of Covid-19"", 'Skyworks, Broadcom Are Trading Lower Today, Thanks To Apple', 'Why Apple Stock Was Down Today', 'Stocks mixed: Apple and Nvidia lead Nasdaq down, 10-year Treasury dips, oil and bitcoin up', '10 Biotech Stocks in Billionaire Ray Dalios Portfolio', 'Apple postpones return to work plans indefinitely, temporarily closes a few stores', 'Apple Builds New Team in Southern California to Bring More Wireless Chips In-House', '15 best tech gifts to spoil a gadget geek this Christmas', 'Sustainable IPOs, Apple delays return to office, Bruce Springsteen sells music catalog, McDonalds settles with former CEO', 'KeyBanc Warns Against Heavily Constrained Apple iPhone 13 Supply', 'Could Apple Soon Deploy a Fully Autonomous Vehicle?', 'France Restricts Travel From U.K.; Astra Drug: Virus Update', 'Covids Resurgence Is Halting Reopening Plans. What to Know.', ""Supply chain normalizations are 'at the top of our wishlists', strategist says"", '10 Micro-Cap Stocks to Buy According to Hedge Funds', 'Why analysts love Apple right now', 'Why Apple Stock Is Still a Good Buy', 'Apple delays office return plans for employees indefinitely over Omicron surge', 'Zacks Earnings Trends Highlights: Apple and Amazon', 'Covid Pushes Back Office Returns, Cancels Broadway Shows and Hits Pro Sports', 'I Ran A Stock Scan For Earnings Growth And Apple (NASDAQ:AAPL) Passed With Ease', 'Stocks Roar On Fed Certainty, Apple, Moderna and Bruce Springsteen - Five Things To Know', 'Apple Joins Microsoft, Google in Delaying Office Return as Omicron Looms']","['https://www.barrons.com/articles/apple-stock-price-nasdaq-tech-51639690622?siteid=yhoof2', 'https://www.fool.com/investing/2021/12/16/is-the-trade-desk-a-good-stock-to-buy-despite-its/?source=eptyholnk0000202&utm_source=yahoo-host&utm_medium=feed&utm_campaign=article', 'https://www.barrons.com/articles/apple-shares-slide-on-rate-fears-51639690622?siteid=yhoof2', 'https://www.investors.com/market-trend/stock-market-today/dow-jones-dips-as-fed-rally-falters-adobe-stock-dives-on-this-tesla-stock-stalls-as-ford-stock-accelerates/?src=A00220', 'https://finance.yahoo.com/news/apple-leads-big-tech-lower-183218357.html', 'https://finance.yahoo.com/news/meta-cracks-down-companies-spied-200703412.html', 'https://www.fool.com/investing/2021/12/16/why-amd-qualcomm-and-skyworks-stocks-just-crashed/?source=eptyholnk0000202&utm_source=yahoo-host&utm_medium=feed&utm_campaign=article', 'https://www.bizjournals.com/bizjournals/news/2021/12/16/facebook-amazon-microsoft-tesla-apple-stock-market.html?ana=yahoo', 'https://finance.yahoo.com/news/skyworks-broadcom-trading-lower-today-193155341.html', 'https://www.fool.com/investing/2021/12/16/why-apple-stock-was-down-today/?source=eptyholnk0000202&utm_source=yahoo-host&utm_medium=feed&utm_campaign=article', 'https://finance.yahoo.com/video/stocks-mixed-apple-nvidia-lead-182102561.html', 'https://finance.yahoo.com/news/10-biotech-stocks-billionaire-ray-180100336.html', 'https://finance.yahoo.com/video/apple-postpones-return-plans-indefinitely-175400121.html', 'https://finance.yahoo.com/news/apple-builds-team-southern-california-173720494.html', 'https://finance.yahoo.com/news/15-best-tech-gifts-spoil-154231864.html', 'https://finance.yahoo.com/video/sustainable-ipos-apple-delays-return-153504027.html', 'https://finance.yahoo.com/news/keybanc-warns-against-heavily-constrained-152840410.html', 'https://www.fool.com/investing/2021/12/16/could-apple-soon-deploy-a-fully-autonomous-vehicle/?source=eptyholnk0000202&utm_source=yahoo-host&utm_medium=feed&utm_campaign=article', 'https://finance.yahoo.com/news/apple-delays-office-return-canada-223554083.html', 'https://www.barrons.com/articles/covid-cases-omicron-reopening-apple-broadway-princeton-51639650671?siteid=yhoof2', 'https://finance.yahoo.com/video/supply-chain-normalizations-top-wishlists-143444016.html', 'https://finance.yahoo.com/news/10-micro-cap-stocks-buy-141406742.html', 'https://finance.yahoo.com/news/why-analysts-love-apple-right-now-140655190.html', 'https://www.fool.com/investing/2021/12/16/why-apple-stock-is-still-a-good-buy/?source=eptyholnk0000202&utm_source=yahoo-host&utm_medium=feed&utm_campaign=article', 'https://finance.yahoo.com/news/apple-delays-office-return-plans-071030153.html', 'https://finance.yahoo.com/news/zacks-earnings-trends-highlights-apple-112811805.html', 'https://www.barrons.com/articles/covid-omicron-office-returns-broadway-nhl-nfl-princeton-51639650671?siteid=yhoof2', 'https://finance.yahoo.com/news/ran-stock-scan-earnings-growth-092241199.html', 'https://www.thestreet.com/markets/-5-things-you-must-know-before-market-opens-thursday-121621?puc=yahoo&cm_ven=YAHOO', 'https://finance.yahoo.com/news/apple-joins-microsoft-google-delaying-053141776.html']"
3,aapl,2021-12-17,171.14,169.75,169.75,"['18 huge developments reshaping Williamson County', '5 Bold Predictions for 2022', 'Apple (AAPL) Stock Moves -0.65%: What You Should Know', ""Cascend's Ross: Tim Cook is a 'Supply Chain Ninja'"", ""Bruce Springsteen sells music catalog for $500M as streaming boom leads to 'perfect storm' for artists"", 'Tech Stocks Roundup: Apple Brings Back Mask Mandate, Closes Stores Amid Covid-19 Surge', 'Synopsys (SNPS) to Buy Back Stock Worth $200M Under ASR Pact', 'Stock market: Short-term pressures from Omicron variant could be substantial, BCG CEO says', 'Apple stock is smack in the middle of a perfect storm: strategist', 'Is the Semiconductor Shortage Almost Over?', 'Sequoia Capital Finally Gets Red-Pilled\xa0on Crypto Investing', 'PFM Multi-Manager Series Trust Buys Danaher Corp, Monolithic Power Systems Inc, Clorox Co, ...', 'Market check: Stocks choppy in intraday trading', 'Market check: Stocks extend losses after tech sells off', ""How Has Warren Buffett's Stock Portfolio Performed in 2021?"", 'Apple Option Traders Bearish in the Near Term', ""Omicron: Biden warns of winter with 'severe illness and death' as COVID-19 cases rise"", 'Billionaire Tom Sandell is Buying These 10 Stocks', ""Read Why Piper Sandler Lacks Conviction On Apple's In-House Chip Plans"", 'These 5 Stocks Will Make Or Break Nasdaq 100  Price Volume Analysis on AAPL, MSFT, AMZN, TSLA, NVDA', 'Would Apple Hold Up Well in a Recession?']","['https://www.bizjournals.com/austin/news/2021/12/17/austin-williamson-county-development-update.html?ana=yahoo', 'https://www.fool.com/investing/2021/12/17/5-bold-predictions-for-2022/?source=eptyholnk0000202&utm_source=yahoo-host&utm_medium=feed&utm_campaign=article', 'https://finance.yahoo.com/news/apple-aapl-stock-moves-0-224510798.html', 'https://finance.yahoo.com/video/cascends-ross-tim-cook-supply-223853763.html', 'https://finance.yahoo.com/video/bruce-springsteen-sells-music-catalog-221732307.html', 'https://www.thestreet.com/technology/tech-stocks-roundup-apple-brings-back-mask-mandate-closes-stores-amid-covid-19-surge?puc=yahoo&cm_ven=YAHOO', 'https://finance.yahoo.com/news/synopsys-snps-buy-back-stock-182606886.html', 'https://finance.yahoo.com/video/stock-market-short-term-pressures-182359430.html', 'https://finance.yahoo.com/news/apple-stock-is-smack-in-the-middle-of-a-perfect-storm-strategist-175435263.html', 'https://www.fool.com/investing/2021/12/17/is-the-semiconductor-shortage-almost-over/?source=eptyholnk0000202&utm_source=yahoo-host&utm_medium=feed&utm_campaign=article', 'https://finance.yahoo.com/news/sequoia-capital-finally-gets-red-170011436.html', 'https://finance.yahoo.com/news/pfm-multi-manager-series-trust-163804192.html', 'https://finance.yahoo.com/video/market-check-stocks-choppy-intraday-162739376.html', 'https://finance.yahoo.com/video/market-check-stocks-extend-losses-153048144.html', 'https://www.fool.com/investing/2021/12/17/how-has-buffetts-stock-portfolio-performed-2021/?source=eptyholnk0000202&utm_source=yahoo-host&utm_medium=feed&utm_campaign=article', 'https://www.investopedia.com/apple-option-traders-bearish-near-term-5213606?utm_campaign=quote-yahoo&utm_source=yahoo&utm_medium=referral', 'https://finance.yahoo.com/video/omicron-biden-warns-winter-severe-142803123.html', 'https://finance.yahoo.com/news/billionaire-tom-sandell-buying-10-140114965.html', 'https://finance.yahoo.com/news/read-why-piper-sandler-lacks-134400607.html', 'https://finance.yahoo.com/news/5-stocks-break-nasdaq-100-133816168.html', 'https://www.fool.com/investing/2021/12/17/would-apple-hold-up-well-in-a-recession/?source=eptyholnk0000202&utm_source=yahoo-host&utm_medium=feed&utm_campaign=article']"
4,aapl,2021-12-20,169.75,172.99,175.64,"['3 Top Energy Stocks Ready for a Bull Run', ""Why Bruce Springsteen's $500M deal signals a 'perfect storm' brewing in music"", '3 Stocks That Could Be Worth More Than Apple by 2035', 'Would This Retailer Actually Rise During a Stock Market Crash?']","['https://www.fool.com/investing/2021/12/18/3-top-energy-stocks-ready-for-a-bull-run/?source=eptyholnk0000202&utm_source=yahoo-host&utm_medium=feed&utm_campaign=article', 'https://finance.yahoo.com/news/why-bruce-springsteens-500-m-signals-a-perfect-storm-brewing-in-music-141822437.html', 'https://www.fool.com/investing/2021/12/18/stocks-that-could-be-worth-more-than-apple-2035/?source=eptyholnk0000202&utm_source=yahoo-host&utm_medium=feed&utm_campaign=article', 'https://www.fool.com/investing/2021/12/18/would-this-retailer-actually-rise-during-a-stock-m/?source=eptyholnk0000202&utm_source=yahoo-host&utm_medium=feed&utm_campaign=article']"
5,adbe,2021-11-29,687.49,669.85,657.41,"['Adobe Hosts Financial Analyst Meeting; Webcast to Include Q4 & FY2021 Earnings', 'Online sales fell on Black Friday but should bounce back on Cyber Monday, analysts say', 'The News of Omicron is Dominating the Market: What to Do Now', 'Why Amazon Is Rising Higher on Cyber Monday', 'Cyber Monday poised to be the biggest online shopping day of the year, but may still fall short of last years total', '2 Unstoppable Stocks to Buy Now and Hold Forever', 'Is Autodesk Stock a Buy?']","['https://finance.yahoo.com/news/adobe-hosts-financial-analyst-meeting-210000624.html', 'https://finance.yahoo.com/news/online-sales-fell-black-friday-232312683.html', 'https://finance.yahoo.com/news/news-omicron-dominating-market-now-224915741.html', 'https://www.fool.com/investing/2021/11/29/why-amazon-is-rising-higher-on-cyber-monday/?source=eptyholnk0000202&utm_source=yahoo-host&utm_medium=feed&utm_campaign=article', 'https://www.marketwatch.com/story/cyber-monday-poised-to-be-the-biggest-shopping-day-of-the-year-but-may-still-fall-short-of-last-years-total-11638198233?siteid=yhoof2', 'https://www.fool.com/investing/2021/11/29/2-unstoppable-stocks-to-buy-now-and-hold-forever/?source=eptyholnk0000202&utm_source=yahoo-host&utm_medium=feed&utm_campaign=article', 'https://www.fool.com/investing/2021/11/29/is-autodesk-stock-a-buy/?source=eptyholnk0000202&utm_source=yahoo-host&utm_medium=feed&utm_campaign=article']"
6,adbe,2021-11-30,669.85,657.41,671.88,"['Cyber Monday Misses Estimates on Short Supply, Weak Deals', 'Twitters New CEO Joins Club of India-Born U.S. Tech Captains']","['https://finance.yahoo.com/news/flat-cyber-monday-sales-point-043717883.html', 'https://finance.yahoo.com/news/twitter-ceo-joins-club-india-064305487.html']"
7,adbe,2021-12-01,657.41,671.88,616.53,['Adobe Systems (ADBE) Dips More Than Broader Markets: What You Should Know'],['https://finance.yahoo.com/news/adobe-systems-adbe-dips-more-224510702.html']
8,adbe,2021-12-03,616.53,622.04,622.04,"['Adobe worth $26 billion less as DocuSign fears spark knee-jerk reaction for stock', 'Peak issues for supply chains create portfolio opportunities: Chief market strategist', 'Which E-Signature Company Is the Better Buy?', 'Global tax deal leaves billion-dollar loopholes, Reuters analysis finds']","['https://www.marketwatch.com/story/adobe-stock-stumbles-toward-worst-day-in-20-months-as-docusign-fears-spark-knee-jerk-reaction-11638560604?siteid=yhoof2', 'https://finance.yahoo.com/news/peak-issues-for-supply-chains-create-portfolio-opportunities-chief-market-strategist-183659348.html', 'https://www.fool.com/investing/2021/12/03/which-e-signature-company-is-the-better-buy/?source=eptyholnk0000202&utm_source=yahoo-host&utm_medium=feed&utm_campaign=article', 'https://finance.yahoo.com/news/global-tax-deal-leaves-billion-105224031.html']"
9,adbe,2021-12-06,622.04,649.96,653.1,"['Is Adobe Inc. (ADBE) Going to Burn These Hedge Funds?', 'Dow Jones Futures Rise As Tesla Leads Techs Lower In Grizzly Market; Lucid Dives On SEC Probe']","['https://finance.yahoo.com/news/adobe-inc-adbe-going-burn-213834333.html', 'https://www.investors.com/market-trend/stock-market-today/dow-jones-futures-market-woes-intensify-docusign-craters-apple-adobe-tesla-in-focus/?src=A00220']"
10,adbe,2021-12-07,649.96,653.1,632.57,['Why High-Growth Tech Stocks Like Datadog Rose Today'],['https://www.fool.com/investing/2021/12/07/why-high-growth-tech-stocks-like-datadog-rose-toda/?source=eptyholnk0000202&utm_source=yahoo-host&utm_medium=feed&utm_campaign=article']
11,adbe,2021-12-08,653.1,632.57,654.45,"['Adobe Systems (ADBE) Outpaces Stock Market Gains: What You Should Know', 'Adobe Nears Deal for Social Marketing Startup ContentCal', 'Stock Market News for Dec 8, 2021']","['https://finance.yahoo.com/news/adobe-systems-adbe-outpaces-stock-224510705.html', 'https://finance.yahoo.com/news/adobe-nears-deal-social-marketing-170037873.html', 'https://finance.yahoo.com/news/stock-market-news-dec-8-143502351.html']"
12,adbe,2021-12-09,632.57,654.45,658.3,"['Adobe (ADBE) to Boost Creative Capabilities With ContentCal', ""Adobe Systems (ADBE) Earnings Expected to Grow: What to Know Ahead of Next Week's Release"", 'Prices for almost everything online are surging: Adobe data', 'Online Prices Hit Record Levels as Shortages Bite Holiday Shoppers', 'Adobe Report: Inflation Online\xa0Soars', 'Adobe Digital Price Index: Online Inflation Hits Record High', 'Online Consumer Prices Rose in November for 18th Straight Month: Adobe', 'Should You Buy DocuSign Stock on the Dip?']","['https://finance.yahoo.com/news/adobe-adbe-boost-creative-capabilities-233911436.html', 'https://finance.yahoo.com/news/adobe-systems-adbe-earnings-expected-200008981.html', 'https://finance.yahoo.com/news/prices-for-almost-everything-online-are-surging-study-164745563.html', 'https://www.barrons.com/articles/online-prices-hit-record-levels-as-shortages-bite-holiday-shoppers-51639007517?siteid=yhoof2', 'https://finance.yahoo.com/news/adobe-report-inflation-online-soars-130006663.html', 'https://finance.yahoo.com/news/adobe-digital-price-index-online-130000008.html', 'https://www.thestreet.com/investing/online-consumer-prices-rose-in-nov-18th-straight-month?puc=yahoo&cm_ven=YAHOO', 'https://www.fool.com/investing/2021/12/09/should-you-buy-docusign-stock-right-now/?source=eptyholnk0000202&utm_source=yahoo-host&utm_medium=feed&utm_campaign=article']"
13,adbe,2021-12-10,654.45,658.3,658.3,"['The Funded: The chairman of the SEC is seeking tighter rules for SPACs', 'Jackson Wealth Management, LLC Buys BlackRock Inc, Adobe Inc, Equifax Inc, Sells Lam Research ...', 'Sprinklr CEO on becoming a major customer experience player like Salesforce, Adobe, and Microsoft', 'Adobe (ADBE), Real Madrid Unite for Experience Cloud Services', 'ETFs to Benefit From a Record Surge in Online Prices', 'Oracle (ORCL) Beats Q2 Earnings and Revenue Estimates']","['https://www.bizjournals.com/sanjose/news/2021/12/10/tighter-rules-may-be-coming-for-spac-mergers.html?ana=yahoo', 'https://finance.yahoo.com/news/jackson-wealth-management-llc-buys-183805579.html', 'https://finance.yahoo.com/video/sprinklr-ceo-becoming-major-customer-154849766.html', 'https://finance.yahoo.com/news/adobe-adbe-real-madrid-unite-151803269.html', 'https://finance.yahoo.com/news/etfs-benefit-record-surge-online-150503774.html', 'https://finance.yahoo.com/news/oracle-orcl-beats-q2-earnings-094409458.html']"
