,date,title,content,symbols,tags
0,2021-12-26T12:45:00+00:00,3 Stocks that Beat the Market in 2021 and Could Do It Again in 2022,"When looking for investment ideas for 2022, it pays to look at those stocks that have beaten the market in 2021. Savvy investors know that winners tend to keep on winning, so picking stocks that are already in the market-beating category can increase your odds of investing success.","['AAPL.US', 'AMZN.US', 'MSFT.US', 'ASAN.US', 'DOCN.US', 'AAPL34.SA', 'MSFT.MX', 'AMZO34.SA', 'AAPL.MX', 'AMZ.XETRA', 'AMZ.F', 'APC.F', 'APC.XETRA', 'MSFT34.SA', 'MSF.XETRA', 'MSF.F', 'AMZN.MX']","['APPLE', 'IMAGE SOURCE', 'DIGITALOCEAN']"
1,2021-12-24T23:23:38+00:00,"Microsoft joins Google, Amazon, others in canceling in-person presence at CES","By Vishal Vivek

(Reuters) - Microsoft Corp said on Friday it will not participate in person at the Consumer Electronics Show (CES) 2022 in Las Vegas, joining a list of companies opting not to have a physical presence at next month's event on concerns over the rapid spread of the Omicron COVID-19 variant.

The U.S. software giant added that it will continue to participate at CES remotely, according to an emailed statement. The Verge was the first to report on Friday that Microsoft will not participate physically AT CES.

Several other companies including U.S. automaker General Motors Co, Alphabet Inc.'s Google and its self-driving auto-technology company Waymo, Facebook parent Meta Platforms Inc, Twitter Inc, Lenovo Group, AT&T Inc and Amazon.com Inc dropped in-person attendance plans earlier this week.

CES officials on Thursday said the event will still be held in person Jan. 5-8 with ""strong safety measures in place,"" which include vaccination requirements, masking and availability of COVID-19 tests.

(Reporting by Vishal Vivek in Bengaluru; Additional reporting by Anirudh Saligrama in Bengaluru; Editing by Leslie Adler and Hugh Lawson)","['MSFT.US', 'MSFT.MX', 'MSFT34.SA', 'MSF.XETRA', 'MSF.F']","['MICROSOFT CORP', 'TWITTER INC', 'PHYSICAL PRESENCE', 'LENOVO GROUP']"
2,2021-12-24T19:38:01+00:00,"Rational Insider Buy VA Buys OppFi Inc, SoFi Technologies Inc, SoFi Technologies Inc, Sells ...","Investment company Rational Insider Buy VA (Current Portfolio) buys OppFi Inc, SoFi Technologies Inc, SoFi Technologies Inc, Okta Inc, Zoom Video Communications Inc, sells Peloton Interactive Inc, Intercontinental Exchange Inc, Bandwidth Inc, MarketAxess Holdings Inc, At Home Group Inc during the 3-months ended 2021Q3, according to the most recent filings of the investment company, Rational Insider Buy VA. As of 2021Q3, Rational Insider Buy VA owns 29 stocks with a total value of $22 million. These are the details of the buys and sells.

New Purchases: OPFI, SOFI, SOFI, Added Positions: OKTA, ZM, RNG, Reduced Positions: CRWD, GOOG, SQ, FVRR, FB, NOW, NFLX, DOCU, SEDG, PYPL, MELI, BILI, MA, XPEL, TDOC, ADBE, VEEV, MSFT, RGEN, JYNT, MIME, APPS, EVBG, Sold Out: PTON, ICE, BAND, MKTX, HOME, HGV, SFIX, CRNC, EXPO, WIX, EGHT, RDVT, PCTY,

Warning! GuruFocus has detected 5 Warning Signs with OKTA. Click here to check it out.  OKTA 15-Year Financial Data The intrinsic value of OKTA Peter Lynch Chart of OKTA

For the details of Rational Insider Buy VA's stock buys and sells,
go to https://www.gurufocus.com/guru/rational+insider+buy+va/current-portfolio/portfolio

These are the top 5 holdings of Rational Insider Buy VA

Meta Platforms Inc (FB) - 6,435 shares, 9.84% of the total portfolio. Shares reduced by 4.74% OppFi Inc (OPFI) - 169,182 shares, 5.99% of the total portfolio. New Position DocuSign Inc (DOCU) - 4,665 shares, 5.41% of the total portfolio. Shares reduced by 4.7% Okta Inc (OKTA) - 4,580 shares, 4.90% of the total portfolio. Shares added by 51.16% ServiceNow Inc (NOW) - 1,740 shares, 4.88% of the total portfolio. Shares reduced by 10.08%

New Purchase: OppFi Inc (OPFI)

Rational Insider Buy VA initiated holding in OppFi Inc. The purchase prices were between $0 and $10.85, with an estimated average price of $8.25. The stock is now traded at around $4.850000. The impact to a portfolio due to this purchase was 5.99%. The holding were 169,182 shares as of 2021-09-30.

Story continues

New Purchase: SoFi Technologies Inc (SOFI)

Rational Insider Buy VA initiated holding in SoFi Technologies Inc. The purchase prices were between $13.75 and $18.25, with an estimated average price of $15.7. The stock is now traded at around $15.090000. The impact to a portfolio due to this purchase was 4.41%. The holding were 61,645 shares as of 2021-09-30.

New Purchase: SoFi Technologies Inc (SOFI)

Rational Insider Buy VA initiated holding in SoFi Technologies Inc. The purchase prices were between $13.75 and $18.25, with an estimated average price of $15.7. The stock is now traded at around $15.090000. The impact to a portfolio due to this purchase was 4.41%. The holding were 61,645 shares as of 2021-09-30.

Added: Okta Inc (OKTA)

Rational Insider Buy VA added to a holding in Okta Inc by 51.16%. The purchase prices were between $228.93 and $271.75, with an estimated average price of $248.53. The stock is now traded at around $228.310000. The impact to a portfolio due to this purchase was 1.66%. The holding were 4,580 shares as of 2021-09-30.

Added: Zoom Video Communications Inc (ZM)

Rational Insider Buy VA added to a holding in Zoom Video Communications Inc by 46.54%. The purchase prices were between $257.41 and $401.12, with an estimated average price of $337.35. The stock is now traded at around $191.650000. The impact to a portfolio due to this purchase was 1.15%. The holding were 3,070 shares as of 2021-09-30.

Added: RingCentral Inc (RNG)

Rational Insider Buy VA added to a holding in RingCentral Inc by 22.26%. The purchase prices were between $212.13 and $303.93, with an estimated average price of $254.02. The stock is now traded at around $192.460000. The impact to a portfolio due to this purchase was 0.89%. The holding were 4,970 shares as of 2021-09-30.

Sold Out: Peloton Interactive Inc (PTON)

Rational Insider Buy VA sold out a holding in Peloton Interactive Inc. The sale prices were between $85.4 and $126.43, with an estimated average price of $110.52.

Sold Out: Intercontinental Exchange Inc (ICE)

Rational Insider Buy VA sold out a holding in Intercontinental Exchange Inc. The sale prices were between $114.82 and $121.36, with an estimated average price of $118.73.

Sold Out: Bandwidth Inc (BAND)

Rational Insider Buy VA sold out a holding in Bandwidth Inc. The sale prices were between $87.85 and $140.5, with an estimated average price of $115.67.

Sold Out: MarketAxess Holdings Inc (MKTX)

Rational Insider Buy VA sold out a holding in MarketAxess Holdings Inc. The sale prices were between $417.22 and $492.13, with an estimated average price of $459.17.

Sold Out: At Home Group Inc (HOME)

Rational Insider Buy VA sold out a holding in At Home Group Inc. The sale prices were between $36.74 and $37.02, with an estimated average price of $36.87.

Sold Out: Hilton Grand Vacations Inc (HGV)

Rational Insider Buy VA sold out a holding in Hilton Grand Vacations Inc. The sale prices were between $37.64 and $49.93, with an estimated average price of $42.36.

Reduced: Fiverr International Ltd (FVRR)

Rational Insider Buy VA reduced to a holding in Fiverr International Ltd by 51.54%. The sale prices were between $161.38 and $258.6, with an estimated average price of $201.76. The stock is now traded at around $117.270000. The impact to a portfolio due to this sale was -0.49%. Rational Insider Buy VA still held 504 shares as of 2021-09-30.

Reduced: Microsoft Corp (MSFT)

Rational Insider Buy VA reduced to a holding in Microsoft Corp by 66.67%. The sale prices were between $271.6 and $305.22, with an estimated average price of $290.9. The stock is now traded at around $334.690000. The impact to a portfolio due to this sale was -0.06%. Rational Insider Buy VA still held 30 shares as of 2021-09-30.

Reduced: Repligen Corp (RGEN)

Rational Insider Buy VA reduced to a holding in Repligen Corp by 22.92%. The sale prices were between $194.77 and $324.21, with an estimated average price of $256.26. The stock is now traded at around $264.650000. The impact to a portfolio due to this sale was -0.04%. Rational Insider Buy VA still held 185 shares as of 2021-09-30.

Here is the complete portfolio of Rational Insider Buy VA. Also check out:

1. Rational Insider Buy VA's Undervalued Stocks

2. Rational Insider Buy VA's Top Growth Companies, and

3. Rational Insider Buy VA's High Yield stocks

4. Stocks that Rational Insider Buy VA keeps buyingThis article first appeared on GuruFocus.","['ZM.US', 'MSFT.US', 'PTON.US', 'RGEN.US', 'ICE.US', 'MKTX.US', 'HGV.US', 'OKTA.US', 'FVRR.US', 'BAND.US', 'RNG.US', 'SOFI.US', 'OPFI.US', 'MSFT.MX', 'IC2.F', '2ON.F', '3RCA.F', '5ZM.F', 'MSFT34.SA', 'MSF.XETRA', 'MSF.F', '0OK.F', 'MWI.F', 'RGN.F', '11V.F', 'HIE.F']",[]
3,2021-12-24T16:35:00+00:00,10 Tech Stocks to Buy According to Former VP Al Gore,"In this article, we discuss the 10 tech stocks to buy according to former VP Al Gore. You can skip our detailed analysis of Al Gore's hedge fund and recent developments, and go directly to read 5 Tech Stocks to Buy According to Former VP Al Gore.

Former Vice President of the US Al Gore’s Generation Investment Management invests heavily in tech companies, especially those that incorporate the problem of climate in their operations and long-term strategy. Al Gore is currently serving as the chairman of Generation Investment Management, which he founded in 2004 along with David Blood.

Following his strategy of sustainable investing, Al Gore started ‘Just Climate’, a fund that would launch certain projects to decarbonize the economy. The fund is backed by some prominent investors, such as Goldman Sachs, Harvard Management Co., and Microsoft’s Climate Innovation Fund.

As of Q3, Generation Investment Management’s 13F portfolio holds a value of over $24 billion. In this article, we will focus on the tech stocks in Al Gore’s portfolio. Some of them are Alphabet Inc. (NASDAQ:GOOG), Amazon.com, Inc. (NASDAQ:AMZN), Alibaba Group Holding Limited (NYSE:BABA), Intel Corporation (NASDAQ:INTC), and Microsoft Corporation (NASDAQ:MSFT). 10 Tech Stocks to Buy According to Former VP Al Gore

Our Methodology:

In this article, we will discuss technology stocks in Al Gore's 13F portfolio as of Q3. For this list, we took data from Generation Investment Management's Q3 portfolio. The stocks are ranked according to their position in the portfolio.

Tech Stocks to Buy According to Former VP Al Gore

10. Synopsys, Inc. (NASDAQ:SNPS)

Number of Hedge Fund Holders: 43

Generation Investment Management’s Stake Value: $291,967,000

Synopsys, Inc. (NASDAQ:SNPS) is an American technology company that specializes in chip design, software security, and IP integration. On December 2, the stock jumped 6.6%, as the company reported solid earnings in fiscal Q4. Synopsys, Inc. (NASDAQ:SNPS) experienced an 11.7% year-over-year growth in its revenue, while the company beat EPS estimates by $0.03 at $1.82.

Story continues

As of Q3 2021, 43 hedge funds in Insider Monkey’s database reported owning stakes in Synopsys, Inc. (NASDAQ:SNPS), up from 41 in the previous quarter. The total value of these stakes is over $2.34 billion. Among these hedge funds, Alkeon Capital Management was the company’s leading shareholder in Q3, holding a $1 billion worth of stake.

Generation Investment Management holds 975,141 shares in Synopsys, Inc. (NASDAQ:SNPS) in Q3, worth roughly $292 million. The company represented 1.21% of Al Gore’s portfolio. Recently, DA Davidson and Wells Fargo raised their price targets on Synopsys, Inc. (NASDAQ:SNPS) to $400 and $415, respectively.

Like Alphabet Inc. (NASDAQ:GOOG), Amazon.com, Inc. (NASDAQ:AMZN), Alibaba Group Holding Limited (NYSE:BABA), Intel Corporation (NASDAQ:INTC), and Microsoft Corporation (NASDAQ:MSFT), Synopsys, Inc. (NASDAQ:SNPS) is also one of the notable tech stocks in Al Gore's portfolio.

Harding Loevner mentioned Synopsys, Inc. (NASDAQ:SNPS) in its Q3 2021 investor letter. Here is what the firm has to say:

“To keep innovating, foundries like those operated by TSMC and Samsung rely on capital equipment made by ASML, a Dutch company that enjoys a near-monopoly in lithography, a specialized process that allows for an increase in the density of transistors and their connections on each silicon wafer. The chips, in addition to getting denser, are also getting architecturally more complex, which presents a challenge for both chip designer and fabricator alike. Computer-aided design (CAD) software from US-based Synopsys not only allows circuits to be modelled down to their most microscopic elements but also offers the capability to verify their functionality and ease of manufacturing and to optimize the performance all virtually before the design is completed.”

9. Microsoft Corporation (NASDAQ:MSFT)

Number of Hedge Fund Holders: 250

Generation Investment Management’s Stake Value: $296,001,000

As Microsoft Corporation (NASDAQ:MSFT) showed growth in cloud computing, the company aims to explore data management in 2022 as it holds a 28% share of the global market. Recently, Morgan Stanley lifted its price target on Microsoft Corporation (NASDAQ:MSFT) to $364, with an Overweight rating on the shares, appreciating the contribution of data management in the company’s gross revenue.

Generation Investment Management started investing in Microsoft Corporation (NASDAQ:MSFT) during the second quarter of 2014. In Q3 2021, the company accounted for 1.23% of former VP Al Gore’s portfolio. Since the start of 2021, the stock is up 48.7%, while its 12-month returns stood at 45.4%, as of the close of December 20.

The number of hedge funds tracked by Insider Monkey having stakes in Microsoft Corporation (NASDAQ:MSFT) grew to 250 in Q3, from 238 in the preceding quarter. These stakes hold a consolidated value of $65.8 billion, up from $62.4 billion.

Baron Funds mentioned Microsoft Corporation (NASDAQ:MSFT) in its Q3 2021 investor letter. Here is what the asset management firm has to say:

“Shares of MicrosoftCorporation, a cloud-software leader and provider of software productivity tools and infrastructure, rose during the quarter following a strong earnings report highlighting solid demand for its broad product stack and continued momentum migrating its business to the cloud. Microsoft’s results continued to be strong across the board, with total revenue beating Street estimates by 4.5%, an acceleration in Commercial Cloud revenue to 31% constant-currency growth, a four-point improvement in Commercial Cloud gross margins (to 70% from 66%), and GAAP earnings up 42%. We believe the company is positioned to deliver 13% to 15% organic growth over the next three years, underpinned by TAM expansion across its disruptive cloud product portfolio, as more companies look to transform and digitize their businesses, as well as strong operating leverage as its cloud products gain scale.”

8. Intel Corporation (NASDAQ:INTC)

Number of Hedge Fund Holders: 66

Generation Investment Management’s Stake Value: $660,262,000

Generation Investment Management increased its stake in Intel Corporation (NASDAQ:INTC) by 76% in Q3 2021. The company accounted for 2.74% of Al Gore’s portfolio. According to analysts, Intel Corporation (NASDAQ:INTC) is well-positioned to grow as annual semiconductor sales are expected to reach $600 billion in 2022.

At the end of Q3 2021, 66 hedge funds tracked by Insider Monkey reported owning stakes in Intel Corporation (NASDAQ:INTC), down from 78 in the previous quarter. These stakes are valued at over $6.4 billion. Ken Fisher’s Fisher Asset Management was the company’s largest shareholder in Q3, with a stake worth $1.7 billion.

Recently, JPMorgan set a $64 price target on Intel Corporation (NASDAQ:INTC), which represents a 23.8% upside. In its Q3 earnings, the company posted an EPS of $1.71, beating estimates by $0.60.

Andaz Private Investments mentioned Intel Corporation (NASDAQ:INTC) in its Q3 2021 investor letter. Here is what the firm has to say:

“Intel (INTC) is trading on a high single digit earnings multiple and is essentially: 1) an oligopolistic foundry set to benefit from large government incentives; and 2) a semiconductor business that is returning to competitiveness after years of being a laggard.”

7. Alibaba Group Holding Limited (NYSE:BABA)

Number of Hedge Fund Holders: 115

Generation Investment Management’s Stake Value: $723,636,000

Alibaba Group Holding Limited (NYSE:BABA) saw a decline in the number of hedge funds having stakes in it. In Q3, 115 hedge funds tracked by Insider Monkey held stakes in the company, down significantly from 146 in the preceding quarter. These stakes hold a value of over $10.2 billion.

Generation Investment Management started building its position in Alibaba Group Holding Limited (NYSE:BABA) during the fourth quarter of 2020, with shares worth roughly $360 million. In Q3 2021, the hedge fund holds a stake worth $723.6 million in the company, which accounted for 3% of Al Gore’s portfolio. Recently, Morgan Stanley noted that Alibaba Group Holding Limited (NYSE:BABA) has the potential to drive average revenue per user due to the diversification in its supplies and products. The firm lifted its price target on the stock to $180, while maintaining an Overweight rating on the shares.

In fiscal Q2 2021, Alibaba Group Holding Limited (NYSE:BABA) experienced a 29% year-over-year growth in revenue at $31.1 billion. Moreover, the company’s annual active customers were recorded at 1.24 billion, presenting an increase of 62 million customers from the prior-year quarter.

Palm Capital mentioned Alibaba Group Holding Limited (NYSE:BABA) in its Q3 2021 investor letter. Here is what the firm has to say:

“Over the past few months, political and regulatory turmoil has caused sharp collapses in the share prices of certain Chinese companies and clients have been increasingly asking us why we don’t invest in the country.

When we’ve answered this question in the past, we’ve found it useful to use the example of Alibaba. On face value, Alibaba appears to be a phenomenal business. It is the world’s largest e-commerce company in the world’s fastest-growing major economy. The marketplaces it operates are the most highly visited in China pointing to seemingly unassailable network effect advantages. These are solidified by its substantial investments and partnerships in an unrivalled logistics network. The company also has a crucial early mover advantage in cloud computing giving it a scale advantage that may quickly take it out of reach of competitors. And relative to its growth, the share often appears to be cheap.

However, if you dig beneath the surface, the investment case becomes less clear.

Alibaba’s accounting is questionable and murky, and its disclosure is poor. The company’s corporate structure is an intricate web of over 1,200 separate entities. And a staggering 890 of these entities were formed or acquired in the three years ending 2020. A large portion of its revenue growth each year is from consolidation of acquisitions with little disclosure of just how much. Significant entities appear and disappear from the company’s disclosures from year to year with no explanation. And almost three-quarters of the company’s total retained earnings since its 2014 IPO is from asset write ups with little explanation to back these up.”

6. Nutanix, Inc. (NASDAQ:NTNX)

Number of Hedge Fund Holders: 28

Generation Investment Management’s Stake Value: $731,210,000

Nutanix, Inc. (NASDAQ:NTNX) is an American cloud computing company that also provides software services. In Q3, Generation Investment Management increased its stake in the company by 4% and now holds shares worth over $731.2 million. Nutanix, Inc. (NASDAQ:NTNX) accounted for 3.03% of former VP Al Gore’s portfolio.

Over the last two years, Nutanix, Inc. (NASDAQ:NTNX) has beaten EPS estimates 100% of the time. In fiscal Q1 2022, following its previous trend, the company beat EPS consensus by $0.12 at -$0.22. According to Susquehanna, Nutanix, Inc. (NASDAQ:NTNX) is expected to deliver $1 billion in annual recurring revenue in the coming years. The firm lifted its price target on the stock to $50, with a Positive rating on the shares.

At the end of Q3 2021, 28 hedge funds in Insider Monkey’s database reported owning stakes in Nutanix, Inc. (NASDAQ:NTNX), down from 29 in the previous quarter. The total value of these stakes is over $1.2 billion.

Like Alphabet Inc. (NASDAQ:GOOG), Amazon.com, Inc. (NASDAQ:AMZN), Alibaba Group Holding Limited (NYSE:BABA), Intel Corporation (NASDAQ:INTC), and Microsoft Corporation (NASDAQ:MSFT), investors and analysts are also paying attention to Nutanix, Inc. (NASDAQ:NTNX) in 2021.

Andaz Private Investments mentioned Nutanix, Inc. (NASDAQ:NTNX) in its Q2 2021 investor letter. Here is what the firm has to say:

“We increased Nutanix (NTNX) from a c.11% weight to the maximum 15% weight purchasing at $27.46 and $26.72 on May 5 and 6 respectively… We invested into several tech situations which were discarded by the market in May on inflation concerns.”

Click to continue reading and see 5 Tech Stocks to Buy According to Former VP Al Gore.

Suggested articles:

10 Best Tech Stocks To Invest in Now 20 Fastest Growing Tech Cities In The World 10 Best Non Tech Stocks To Buy Now

Disclosure. None. 10 Tech Stocks to Buy According to Former VP Al Gore is originally published on Insider Monkey.","['BABA.US', 'AMZN.US', 'MSFT.US', 'INTC.US', 'SNPS.US', 'NTNX.US', 'MSFT.MX', 'AMZO34.SA', 'AMZ.XETRA', 'ITLC34.SA', 'SYP.F', 'BABAF.US', 'AMZ.F', 'MSFT34.SA', 'MSF.XETRA', 'MSF.F', 'AMZN.MX', '9988.HK', 'AHLA.XETRA', 'AHLA.F', 'INL.F', 'INL.XETRA', 'INTC.MX', '0NU.F', 'GOOG.US']","['MICROSOFT', 'MICROSOFT CORPORATION', 'INC', 'HEDGE FUND', 'INTEL CORPORATION', 'INVESTMENT MANAGEMENT', 'GENERATION INVESTMENT MANAGEMENT', 'SYNOPSYS', 'ALIBABA GROUP HOLDING LIMITED', 'AL GORE']"
