,date,title,content,symbols,tags
4,2021-12-24T15:50:13+00:00,How Coinbase rode crypto’s ‘inflection point’ to a rocky but momentous year,"In 2021, Microsoft (MSFT) – Yahoo Finance’s company of the year – saw its market capitalization top $2 trillion.

During the year, the ascendant cryptocurrency asset class set two major milestones: its market cap also topped $2 trillion, and Coinbase (COIN), the most popular U.S. based crypto exchange, went public on the Nasdaq through the largest ever direct listing.

With a market cap of just over $70 billion, Coinbase’s value is just a fraction compared to tech heavyweights like Nasdaq, but is multiples higher than the $8 billion valuation it fetched only a few years before. That’s no small feat considering Coinbase Global CEO Brian Armstrong co-founded the company with Fred Ehrsam at a time when Bitcoin cost less than $10 (it traded above $50,000 on Friday).

“The industry had reached a critical inflection point,” Emilie Choi, Coinbase’s president and COO, told Yahoo Finance in an interview.

She added that in many ways, Coinbase’s entry into the public markets was reflective of the mainstream financial world’s acceptance and adoption of cryptocurrencies, and how the sector has matured since its birth over a decade ago.

The company’s stock rode a euphoric wave that reflected the frothiness of digital coins, where Bitcoin’s (BTC-USD) price was setting record after record. Coinbase’s stock briefly touched $429 in its debut, briefly pushing its market value over $100 billion before it came back to earth.

Currently, the stock is down 45% or $90, trading at $238 per share from its debut high, weighed by a combination of factors: a deep crypto rout; China’s sudden decision to ban cryptocurrency mining; COVID-19 risk aversion; and head-spinning volatility stemming from the Federal Reserve’s looming rate hike campaign.

Growing Pains NEW YORK, NY - MAY 15: Coinbase Founder and CEO Brian Armstrong attends Consensus 2019 at the Hilton Midtown on May 15, 2019 in New York City. (Photo by Steven Ferdman/Getty Images)

The momentous rise and precipitous drop from Coinbase’s debut price says a lot about the volatility in crypto, where fortunes are being made and lost at lightning speed. But it also explains why the firm performed so well over the past year, and why equity analysts see longer term issues with its current business model.

Short-term speculation in crypto comes with big risks and rewards. The digital coin boom has been both lucrative and devastating for small investors, and those outcomes shape Coinbase’s profit margins.

Story continues

The company’s core exchange business generates revenue from a percentage fee, or the “spread” charged on top of every user's trade. Based on its financials, Coinbase draws its best spreads from newer participants making smaller-retail sized trades on Coinbase’s platform.

Its Pro offering for institutions charges much cheaper transaction fees and also offers leverage.

On the day of Coinbase’s direct listing, revenue from trading fees accounted for 97% of the firm’s total revenue. As of the company’s latest earnings release in November, that percentage dipped to 89%. Of that figure, revenue from retail-sized orders accounted for 93.8% while much larger institutional customers made up only 6.2%.

In short, Coinbase generates most of its revenue during volatile but upward-trending market conditions, when crypto investor sentiment is at its highest.

That recipe has worked out for the company in 2021, but doesn’t bode well during sluggish periods of the market. During most of 2018 for example, newer retail-sized users tended to trade less often and institutional customers made a higher percentage of total trading volume.

It's during slow times that exchanges need to retain customer funds. All exchanges compete for customer assets under management. To incentivize customers to hold crypto, platforms been increasingly turning to creative methods to mimic the features of traditional asset classes — namely, the ability to pay customers interest on their holdings.

This is the heart of the current movement toward decentralized finance (DeFi), where investors earn way more from yields on crypto-based accounts than the average, low-yielding savings account.

But regulators are skeptical of these efforts, even when offered by centralized crypto firms. In September, Coinbase announced plans to offer customers a ""high-yield alternative to traditional savings accounts"" paying 4% on USD Coin, a stablecoin redeemable one-to-one for each U.S. dollar.

But the Securities and Exchange Commission abruptly intervened, claiming the offering amounted to a security, which would require registration and open a regulatory can of worms.

In a lengthy Twitter post at the time, Armstrong lashed out at what he called “really sketchy behavior” by regulators, but nevertheless, Coinbase bowed to the SEC’s concerns.

Instead, at the beginning of December, it launched a DeFi yield product for customers outside the U.S. –and its own financial returns from DeFi lending underscored why. During the quarter, Coinbase had grown its revenue from staking from $3.3 to $81 million over a single year.

Robinhood (HOOD) deals with a similar issue, but because it uses a payment for order flow (PFOF) model particular to stocks, its zero commission trading fees prevent competitors from offering better prices. And like Robinhood, the Coinbase model has its share of critics.

“I want them to diversify their revenue stream and be a broader crypto platform, not just trading,” Chris Bendler, managing director and senior equity analyst with D.A. Davidson Companies told Yahoo Finance. His critique echoed the opinion of other analysts covering the stock.

Coinbase’s current business model means that its share price acts almost like a “bellwether” for the crypto market, Bender explained. And since COIN’s debut, its value correlates very closely, on average by about 60%, to Bitcoin, D.A. Davidson’s research sows.

Devin Ryan, senior analyst and director of financial technology research with J.M.P. Securities, said that for Coinbase to be a long term success story, it needs “to see terminal growth in other aspects of its business model.”

If you’re bullish on bitcoin and the future of this blockchain-powered economy, then Coinbase is a great play.Chris Bendler, managing director, D.A. Davidson

Since going public, Armstrong and Choi have publicly signaled how the company is working to address these concerns, using their successful exchange business as the beginning of a larger play to build out the infrastructure of a rapidly expanding crypto market.

Ryan argued that the company’s exchange business positions Coinbase to be one of the best companies in the crypto space. It can build itself into an “Amazon of assets” as Armstrong stated during its Q2 earnings call, as well as a foundational company for the blockchain-built internet that crypto optimists envision.

Addressing the strategy, Coinbase has announced a bevy of new products and features for 2022, such as a platform devoted to the booming non-fungible token (NFT) movement, and Coinbase One, a monthly subscription trading service that waives commission fees in addition to enhanced features.

While not quite as convinced, D.A. Davidson’s Bendler argues that the correlation between COIN and the larger crypto market serves as a massive advantage when it comes to branding.

“It's almost like Xerox or Kleenex, when people think about trading crypto, they think Coinbase. It's a huge advantage for their cost of customer acquisition,” Bendler told Yahoo Finance.

‘A great play’ BRAZIL - 2021/08/06: In this photo illustration the Coinbase logo seen displayed on a smartphone screen, in the background, a bitcoin cryptocurrency is displayed. (Photo Illustration by Rafael Henrique/SOPA Images/LightRocket via Getty Images)

Meanwhile, investors and analysts see Coinbase’s current leadership team as integral to its future. Ryan Selkis, Founder and CEO of Messari, recently argued in his firm’s end-of-year report that outside of Brian Armstrong, Choi is also “most responsible for the company’s ongoing success.”

It’s not hard to understand why. Choi, who joined Coinbase in 2018, is essential to helping the firm establish their infrastructure strategy.

She has spearheaded the company’s aggressive approach to mergers and acquisitions, which according to The Block Research, has included 5 companies this year, and 27 altogether – making Coinbase the most active crypto company in the M&A space. Notable acquisitions led by Choi include major custody provider Xapo (2019) and institutional trading firm Tagomi (2020), – both of which will increase service offerings to large institutional investors.

And the firm is positioning its earlier pickup of the infrastructure company, Bison Trails (now rebranded to Coinbase Cloud), as a blockchain hosting service provider for developers similar to Amazon (AMZN) Web Services (AWS), the tech giant’s greatest money maker.

Though crypto purists might shy away from COIN simply because it’s underperformed BTC and ETH since its launch, D.A. Davidson’s Bendler said that many of the stock’s investors are “traditional fintech investors” who seek exposure to crypto with a growth story, at a reasonable price.

“It's not ridiculously expensive for what it is. If you’re bullish on bitcoin and the future of this blockchain-powered economy, then Coinbase is a great play,” Bendler added.

Read the latest financial and business news from Yahoo Finance

Read the latest cryptocurrency and bitcoin news from Yahoo Finance

Follow Yahoo Finance on Twitter, Instagram, YouTube, Facebook, Flipboard, and LinkedIn","['AMZN.US', 'MSFT.US', 'NXJ.US', 'COIN.US', 'BTC-USD.CC', 'ETH.CC', 'BTC.CC', 'DOGE.CC', 'ETH-USD.CC', 'MSFT.MX', 'AMZO34.SA', 'DOGE-USD.CC', 'AMZ.XETRA', 'MS-PA.US', 'AMZ.F', 'SHIB.CC', 'MSFT34.SA', 'MSF.XETRA', 'MSF.F', 'AMZN.MX', 'SHIB-USD.CC']","['COINBASE', 'BRIAN ARMSTRONG', 'EMILIE CHOI']"
5,2021-12-24T14:29:32+00:00,Billionaire Philippe Laffont is Selling These 10 Stocks,"In this article, we discuss the 10 stocks billionaire Philippe Laffont is selling. If you want to skip our detailed analysis of Laffont’s history, investment philosophy, and hedge fund performance, go directly to Billionaire Philippe Laffont is Selling These 5 Stocks.

Philippe Laffont earned his bachelor's degree in computer science from MIT in 1991. Later, he worked as an analyst for McKinsey & Company. In 1996, he joined Tiger Management LLC as a research analyst, focused on telecommunications companies, after working as an independent consultant. Laffont started Coatue Management in 1999.

Coatue Management focuses on technology, media, telecommunications, and the consumer and healthcare sectors in both public and private markets. Billionaire Philippe Laffont is Selling These 10 Stocks

Philippe Laffont of Coatue Management

Coatue Management boosted its stakes in eleven current holdings and added thirteen new equities to its portfolio in the third quarter. Some of the top holdings in Philippe Laffont’s Q3 portfolio are Microsoft Corporation (NASDAQ:MSFT), Broadcom Inc. (NASDAQ:AVGO), and Uber Technologies, Inc. (NYSE:UBER).

Microsoft Corporation (NASDAQ:MSFT) is a new arrival on billionaire Philippe Laffont’s portfolio, as his hedge fund bought about 1.04 million shares of the company, worth $293.24 million. In addition, Michael Turrin of Wells Fargo initiated coverage of Microsoft Corporation (NASDAQ:MSFT) in November, rating the stock as ""Overweight"" and gave a price target of $400.

The hedge fund managed by Philippe Laffont owns 317,584 shares in Broadcom Inc. (NASDAQ:AVGO) worth over $154.01 million, representing close to 0.62% of his portfolio. On December 13, Baird analyst Tristan Gerra raised his price target on Broadcom Inc. (NASDAQ:AVGO) to $690 from $550 and reiterated an “Outperform” rating on the shares.

Coatue Management holds 12.74 million shares in Uber Technologies, Inc. (NYSE:UBER), according to 13F holdings data for the third quarter of 2021, after lowering its stake in the firm by 5% from the second quarter. In December, UBS analyst Lloyd Walmsley rated Uber Technologies, Inc. (NYSE:UBER) as ""Buy"" and gave a price target of $80.

Story continues

Our Methodology

For this research, we analyzed Laffont's 13F portfolio for Q3 2021. We chose the equities that the fund completely sold in Q3.

Billionaire Philippe Laffont is Selling These Stocks

10. Lucid Group, Inc. (NASDAQ:LCID)

Number of Hedge Fund Holders: 18

Percentage Decline in Stake: 100%

Lucid Group, Inc. (NASDAQ:LCID) is an electric car manufacturing company.

Morgan Stanley analyst Adam Jonas boosted his price objective on Lucid Group, Inc. (NASDAQ:LCID) to $16 from $12 in November and kept an “Underweight” rating on the stock.

Overall, 18 hedge funds in the Q3 database of Insider Monkey reported owning stakes in Lucid Group, Inc. (NASDAQ:LCID).

While Laffont owns significant stakes in Microsoft Corporation (NASDAQ:MSFT), Broadcom Inc. (NASDAQ:AVGO), and Uber Technologies, Inc. (NYSE:UBER), Lucid Group, Inc. (NASDAQ:LCID) was offloaded by him in the third quarter.

9. Lightspeed Commerce Inc. (NYSE:LSPD)

Number of Hedge Fund Holders: 26

Percentage Decline in Stake: 100%

Lightspeed Commerce Inc. (NYSE:LSPD) is Montreal-based e-commerce and point-of-sale software firm.

Lightspeed Commerce Inc. (NYSE:LSPD) was upgraded to “Outperform” from “Sector Perform” by Scotiabank analyst Paul Steep in November, with a price objective of $103, down from $121. He believes the stock price reaction to the Q2 results was exaggerated.

In the third quarter of 2021, 26 hedge funds in Insider Monkey’s database of 867 funds held stakes in Lightspeed Commerce Inc. (NYSE:LSPD) compared to 29 funds in the previous quarter. Spencer M. Waxman's Shannon River Fund Management is Lightspeed Commerce Inc.’s (NYSE:LSPD) most significant stakeholder, with 210,000 shares worth $20.25 million.

8. Lemonade, Inc. (NYSE:LMND)

Number of Hedge Fund Holders: 16

Percentage Decline in Stake: 100%

Lemonade, Inc. (NYSE:LMND) is a holding company that specializes in the insurance industry.

In November, Jefferies analyst Yaron Kinar initiated coverage of Lemonade, Inc. (NYSE:LMND), rating the stock as “Underperform” and gave a price target of $49.

Lemonade, Inc. (NYSE:LMND) reported earnings for the third quarter in November, with an EPS of -$1.08, exceeding predictions by $0.08. In addition, the quarterly revenue of $35.7 million increased 100.6% year over year, exceeding nearly $2.18 million expectations.

At the end of the second quarter of 2021, billionaire Philippe Laffont had a $47.25 million stake in Lemonade, Inc. (NYSE:LMND). During the third quarter, he entirely sold off this stake.

Artisan Partners Limited Partnership, an asset management business, featured a few stocks in its Q4 2020 investor letter, and Lemonade, Inc. (NYSE:LMND) was one of them. Here is what the fund had to say:

“We also exited our investment in Lemonade. Lemonade is a digital-first insurance provider, offering both domestic and international homeowners and renters insurance. The company is disrupting its industry, having digitized the entire insurance experience—from client onboarding to claims—in order to build generational relationships with first-time insurance buyers. Using its app, the median time to receive a bindable renters insurance quote from Lemonade is less than two minutes, and the time for a homeowner’s quote is under three minutes. All claims are also filed through the Lemonade app, where a claims-specific bot can pay out applicable claims in as little as three seconds. The company’s longterm strategy is built upon acquiring customers cheaply today as they begin their adult life with the anticipation of growing future premiums as customer demands for insurance products naturally increase as they accumulate typically insured possessions—home and car purchases, travel, pets and providing coverage for beneficiaries in the event of an unforeseen death. We believe the addressable market is massive, particularly given the industry has largely resisted change, giving Lemonade a long runway to take share from weaker legacy competitors. That said, with shares appreciating above our PMV estimate, we exited our campaign.”

7. LegalZoom.com, Inc. (NASDAQ:LZ)

Number of Hedge Fund Holders: 16

Percentage Decline in Stake: 100%

LegalZoom.com, Inc. (NASDAQ:LZ) provides online legal services and solutions. Coatue Management had bought 20,281 of shares of LegalZoom.com, Inc. (NASDAQ:LZ) at the end of the second quarter. But the hedge fund sold off the stock completely in the third quarter

JPMorgan analyst Sterling Auty decreased his price objective on LegalZoom.com, Inc. (NASDAQ:LZ) to $38 from $44 on December 14 while maintaining an “Overweight” rating. The analyst lowered his price expectations in the software technology sector, as part of his 2022 prognosis.

In the third quarter of 2021, 16 hedge funds were bullish on LegalZoom.com, Inc. (NASDAQ:LZ), down from 33 funds in the preceding quarter. The leading stakeholder of LegalZoom.com, Inc. (NASDAQ:LZ) is Select Equity Group, holding 2.82 million shares worth $74.48 million.

6. Intuit Inc. (NASDAQ:INTU)

Number of Hedge Fund Holders: 64

Percentage Decline in Stake: 100%

Intuit Inc. (NASDAQ:INTU) is a software firm that specializes in business and financial management. Evercore ISI analyst Kirk Materne boosted his price objective on Intuit Inc. (NASDAQ:INTU) to $720 from $650 in November and maintained an “Outperform” rating on the stock.

Intuit Inc. (NASDAQ:INTU) posted its Q1 2022 earnings in November. EPS for the quarter totaled $1.53, beating estimates by $0.56. The quarterly revenue came in at $2.01 billion, up 52.3% from the prior-year quarter, exceeding estimates by $200 million.

Coatue Management added Intuit Inc. (NASDAQ:INTU) to its portfolio in the second quarter by buying 26,314 shares. This stake was sold off completely in the third quarter of 2021. Overall, 64 hedge funds in the Q3 database of Insider Monkey reported owning stakes in Intuit Inc. (NASDAQ:INTU). The stakes of these funds are valued at $6.15 billion.

Unlike Microsoft Corporation (NASDAQ:MSFT), Broadcom Inc. (NASDAQ:AVGO), and Uber Technologies, Inc. (NYSE:UBER), Philippe Laffont is selling Intuit Inc. (NASDAQ:INTU).

In its third-quarter 2021 investor letter, Cooper Investors mentioned Intuit Inc. (NASDAQ:INTU). Here is what Cooper Investors said:

“The other meaningful deal during the quarter was Intuit Inc. (NASDAQ:INTU)’s acquisition of Mailchimp for $12bn. Intuit has reinvented itself over the last decade and thrived with a leadership position in QuickBooks Online, the financial accounting software for small businesses (effectively the ‘Xero of the US’). We originally invested in Intuit in February 2020, excited by the QuickBooks prospects.

Management have executed exceptionally well on the opportunity set which has seen the shares double since our initial purchase. However, the company has now conducted two meaningful deals in Mailchimp and Credit Karma worth a combined US$20bn over the last 12 months. The investment proposition has shifted from a focus on QuickBooks to now being a financial and small business software conglomerate. We continue to very much admire the company, but with Intuit Inc. (NASDAQ:INTU) now trading on 50x forward earnings we no longer see such attractive latency on offer, nor the rewards for the level of execution risk and thus we have exited the position.”

Click to continue reading and see Billionaire Philippe Laffont is Selling These 5 Stocks.

Suggested articles:

Hedge Funds are Selling Tesla and Buying These 5 EV Stocks Instead Hedge Funds are Selling These 10 Chinese Stocks Amid Crackdowns Cathie Wood Is Selling These 10 Stocks

Disclosure: None. Billionaire Philippe Laffont is Selling These 10 Stocks is originally published on Insider Monkey.","['LMND.US', 'UBER.US', 'AVGO.US', 'MSFT.US', 'INTU.US', 'LZ.US', 'MSFT.MX', 'AVGO34.SA', 'U1BE34.SA', 'ITU.F', 'MSFT34.SA', 'MSF.XETRA', 'MSF.F', 'UT8.STU', 'UT8.F', 'INTU.MX', 'LSPD.US', 'LCID.US']","['INC', 'MICROSOFT CORPORATION', 'HEDGE FUND', 'BROADCOM INC', 'PHILIPPE LAFFONT', 'UBER TECHNOLOGIES', 'COATUE MANAGEMENT', 'LUCID GROUP']"
